{
  "agent_role_candidates": [
    {
      "display_name": "Robotics Exhibit Guide",
      "expertise": [
        "robotics",
        "education",
        "visitor assistance"
      ],
      "grounded_object_ids": [
        "object_001",
        "object_002",
        "object_003",
        "object_004",
        "object_005",
        "object_006",
        "object_007",
        "object_008",
        "object_009",
        "object_010",
        "object_011",
        "object_012",
        "object_013",
        "object_014",
        "object_015",
        "object_016",
        "object_017",
        "object_018",
        "object_019",
        "object_020",
        "object_021",
        "object_022",
        "object_023",
        "object_024"
      ],
      "mission": "Provide detailed explanations and answer visitor questions about the robotics displays and models in the showroom.",
      "responsible_zone_ids": [
        "zone_collection_1",
        "zone_collection_2",
        "zone_collection_3"
      ],
      "role_id": "role_guide"
    },
    {
      "display_name": "Interactive Demo Facilitator",
      "expertise": [
        "robotics",
        "interactive technology",
        "visitor engagement"
      ],
      "grounded_object_ids": [
        "object_003",
        "object_009",
        "object_015",
        "object_021"
      ],
      "mission": "Assist visitors in operating control consoles and mobile robot models to experience hands-on demonstrations.",
      "responsible_zone_ids": [
        "zone_collection_3"
      ],
      "role_id": "role_demo_facilitator"
    },
    {
      "display_name": "Safety Monitor",
      "expertise": [
        "safety",
        "visitor management"
      ],
      "grounded_object_ids": [
        "object_001",
        "object_002",
        "object_004",
        "object_005",
        "object_007",
        "object_008",
        "object_010",
        "object_011",
        "object_013",
        "object_014",
        "object_016",
        "object_017",
        "object_019",
        "object_020",
        "object_022",
        "object_023"
      ],
      "mission": "Ensure visitor safety around robotic displays and provide guidance on safe interaction.",
      "responsible_zone_ids": [
        "zone_collection_1",
        "zone_collection_2"
      ],
      "role_id": "role_safety_monitor"
    }
  ],
  "domain": "robotics showroom",
  "important_objects": [
    {
      "object_id": "object_003",
      "reason": "Control console enabling interactive demonstrations with mobile robot models."
    },
    {
      "object_id": "object_006",
      "reason": "Mobile robot model used for hands-on visitor interaction and demonstration."
    },
    {
      "object_id": "object_009",
      "reason": "Control console enabling interactive demonstrations with mobile robot models."
    },
    {
      "object_id": "object_015",
      "reason": "Control console enabling interactive demonstrations with mobile robot models."
    },
    {
      "object_id": "object_021",
      "reason": "Control console enabling interactive demonstrations with mobile robot models."
    }
  ],
  "interaction_topics": [
    {
      "description": "Explanation and demonstration of robotic gripper mechanisms and sensor stations.",
      "related_object_ids": [
        "object_001",
        "object_004",
        "object_007",
        "object_010",
        "object_013",
        "object_016",
        "object_019",
        "object_022"
      ],
      "title": "Robotic Grippers and Sensors",
      "topic_id": "topic_grippers_sensors"
    },
    {
      "description": "Assembly techniques and joint models used in robotic systems.",
      "related_object_ids": [
        "object_002",
        "object_005",
        "object_008",
        "object_011",
        "object_014",
        "object_017",
        "object_020",
        "object_023"
      ],
      "title": "Robotic Assembly and Joints",
      "topic_id": "topic_assembly_joints"
    },
    {
      "description": "Control consoles and mobile robot models for interactive visitor experiences.",
      "related_object_ids": [
        "object_003",
        "object_006",
        "object_009",
        "object_012",
        "object_015",
        "object_018",
        "object_021",
        "object_024"
      ],
      "title": "Control and Mobile Robots",
      "topic_id": "topic_control_mobile_robots"
    }
  ],
  "room_purpose": "Educational robotics showroom designed to display and demonstrate various robotic components and systems to visitors.",
  "semantic_zones": [
    {
      "centroid_xz": {
        "x": -0.7,
        "z": -0.7
      },
      "name": "Collection 1: Grippers and Sensors Zone",
      "object_ids": [
        "object_001",
        "object_004",
        "object_007",
        "object_010",
        "object_013",
        "object_016",
        "object_019",
        "object_022"
      ],
      "purpose": "Showcase and educate visitors about robotic grippers and sensor technologies.",
      "visitor_goals_supported": [
        "Learn about robotic grippers",
        "Understand sensor applications in robotics",
        "Interact safely with displays"
      ],
      "zone_id": "zone_collection_1"
    },
    {
      "centroid_xz": {
        "x": 0.35,
        "z": -0.35
      },
      "name": "Collection 2: Assembly and Joint Models Zone",
      "object_ids": [
        "object_002",
        "object_005",
        "object_008",
        "object_011",
        "object_014",
        "object_017",
        "object_020",
        "object_023"
      ],
      "purpose": "Demonstrate robotic assembly processes and joint mechanisms.",
      "visitor_goals_supported": [
        "Understand robotic assembly",
        "Explore joint model functions",
        "Gain insights into robotic mechanics"
      ],
      "zone_id": "zone_collection_2"
    },
    {
      "centroid_xz": {
        "x": -0.35,
        "z": 0.35
      },
      "name": "Collection 3: Control Consoles and Mobile Robots Zone",
      "object_ids": [
        "object_003",
        "object_006",
        "object_009",
        "object_012",
        "object_015",
        "object_018",
        "object_021",
        "object_024"
      ],
      "purpose": "Provide interactive experiences with control consoles and mobile robot models.",
      "visitor_goals_supported": [
        "Operate robotic control consoles",
        "Experience mobile robot demonstrations",
        "Engage in hands-on robotics learning"
      ],
      "zone_id": "zone_collection_3"
    }
  ],
  "visitor_goals": [
    "Learn about different robotic components and their functions",
    "Interact with robotic models and control systems",
    "Understand the principles of robotic assembly and sensor technology",
    "Experience hands-on demonstrations with mobile robots",
    "Gain knowledge about robotics applications and innovations"
  ]
}
